Date,Event,Description
"December 10, 1929",Fisher to Reisner hoping for a permanent post.,Fisher writes from Ramallah. Refers to a letter sent by Reisner “in regard to future prospects.” He has “no income at present” and hopes that he shall “never have to depend upon the uncertainties of two or three months work here and there.”
"March 6, 1930",Fisher to Reisner asking if he has decided about future work in which he might have a share.,"Fisher writes from Ramallah. The American School has proposed a position at $3000 per year, but it seems to be not enough."
"April 4, 1930",Fisher to Reisner commiserating on the problem of assistants.,Fisher writes from Ramallah. Refers to a letter “of April 2nd” sent by Reisner. Mentions that Mr. Stewart complained about a money problem with Reisner while visiting Fisher and Crowfoot. Fisher explains the “difficulty” as having to work with mixed nationalities. He is broke and will have to sell some of his books. He plans to take sole charge of the Yale dig at Jerash this summer.
"April 22, 1930",Fisher to Reisner asking to borrow money.,Fisher writes from Ramallah. He is in a “bad hole” financially due to the failure of several expeditions and an invasion of locusts. The government has taken away all the local workers to fight the locusts. “It is the first time in my life that I have been in such a position and I feel pretty badly after all these years of service to be forced to ask others for financial assistance.”
"May 7, 1931","Fisher to Reisner, still having difficulties with money and still letting it be known that he would like a permanent position.","Fisher writes from Jerash on stationery from the American School of Oriental Research Jerusalem, Palestine. He is again working on Jerash. Complains about the expense of the expedition and how under funded it is.
 “I shall be glad of your advice and suggestions.”"
"September 18, 1931","Fisher writes to Reisner asking if Reisner has given any more thought to “having me return to the fold in Egypt.""","Fisher writes from Jerash on stationery from the American School of Oriental Research Jerusalem, Palestine. He will be engaged until the end of June. He has the post of Professor of Archaeology in the two schools at Jerusalem and Baghdad."
"September 22, 1931",Reisner to Fisher that Fisher might be able to replace Wheeler if Wheeler takes the dead Firth’s place in the staff of the Service.,"Reisner writes from the Pyramids. The matter is still unsettled and nothing will be done until November..
 Reisner mentions specific, positive changes and enlargements to the layout of the camp."
"January 26, 1932",Fisher to Reisner asking if he had been “able to reach any conclusion as to my coming to Egypt with you?”,"Fisher writes on stationery labeled Excavations of Princeton University Antioch, Syria. His job with this expedition ends on July 15th. The American School will expect him to finish the season at Jerash.
 Complains that “Chicago seems to have all the money these days” and they are spending too much money on luxuries and not enough on equipment. Pennsylvania has to postpone all its excavations due to lack of funds."
"May 11, 1932",Fisher to Reisner “wondering why I have not heard from you in such a long time.”,Fisher writes from Antioch. Successful discoveries in Antioch which he describes. Finishing the season at Jerash next and plans for the future are unknown because “the terrible situation in America may upset every scheme for work.” Mentions again that Penn is out of money.
"August 16, 1932",Fisher to Reisner asking if it is possible to “arrange for me on the half year basis for the next few years until you are in a better position to maintain me on a full year basis?”,"Fisher writes from Ramallah. Perhaps from a previous letter from Reisner, Fisher is under the impression that Reisner is not at present in a position to finance a larger scheme. He plans to visit Egypt , “perhaps around Christmas time.” Wants to talk things over with Reisner."
"January 28, 1933",Fisher to Reisner about not having had any word from Reisner. “I am very anxious to know what will happen after the end of July.”,"Fisher writes on stationery from the American School of Oriental Research Jerusalem, Palestine. Princeton has asked for him from April to July. “Please let me know how the matter stands.”"
"February 5, 1933","Joseph Lindon Smith writes to Fisher that Reisner has been ill and that he, Smith, will take his place as head of the expedition.","Smith writes from Harvard Camp, Pyramids. Reisner had detached retina and had to have a second surgery on his eye on January 24th. Smith goes back to Boston on the 10th of this month. Acknowledges that Reisner does want tot have Fisher’s services part time. Smith hopes Fisher can wait."
"February 14, 1933",Fisher to Smith saying he will be available after the end of July.,"Fisher writes on stationery from the American School of Oriental Research Jerusalem, Palestine."
"March 4, 1933",Roosevelt takes office during the American economic depression.,Read here to understand Reisner’s reference to Roosevelt’s trying improve the economy.
"December 17, 1933",Reisner to Fisher that due to financial problems he won’t be able to take on Fisher.,"Reisner writes from Pyramids Post Office, Cairo. He has been busy with publications. He says he has deeply desired to have Fisher’s help for a number of years.. Wheeler left the expedition on August 31st. Complains about what Roosevelt is doing to the economy, coming off the gold standard, paper inflation, and the world financial situation. Says they are suspending excavations and reducing expenditures. He hopes that someday he will be able to hire Fisher. Mrs. Reisner is recovering from a back injury from an automobile ride to Dahshur and Mary is “publishing the Barkal inscriptions.” He hopes Fisher will get work with the other expeditions and that Allan Rowe is the only one who has suspended operations."
"December 20, 1933",Fisher to Reisner asking again about rejoining Reisner in Egypt.,"Fisher writes on stationery from the American School of Oriental Research Jerusalem, Palestine."
"April 25, 1934",Fisher to Reisner “my whole nervous system is completely gone bust and I am as weak and nervous as a cat.”,"Fisher writes on stationery from the American School of Oriental Research Jerusalem, Palestine. The doctor has ordered him a complete rest for four to six months and he will be going to America around May 15th. “It has been one expedition after another with never a thought that I might be human.”
 “I shall always remember you and your continued kindness…”"
"April 30, 1934","Reisner to Fisher that he had a similar problem “the winter before last after the second operation on my eye, but I am happy to say that I have pulled out of it physically and mentally.”","Reisner writes from Harvard Camp, Pyramids. Writes about financial difficulties “which have been increased by President Roosevelt’s efforts to improve the situation.” Working on Publication, but only doing small clearances for recording purposes. Just sent a off a book, Development of the Egyptian Tomb Down to Accession of Cheops. It will be an intro to The Giza Mastabas. The History of the Giza Necropolis is in final revision. Wishes he could have had Fisher’s assistance with the descriptions and that he could have arranged for Fisher to publish a volume on the excavations of Zawiet-el-Aryan. Asks Fisher if remembers anything about a missing map.
 Tells Fisher of a rumor that had been going around that Fisher had been killed in Southern Mesopotamia..
 Note: It seems to me that of all the letters Reisner has ever written to Fisher, this one is the most illustrative of the sort of man Dr. Reisner really was. It is the most kind, inclusive, and reassuring letter, absolutely without condescension, that one colleague could write to another during a time of mental breakdown. Reisner must have had a very good heart to embrace a troubled man like Fisher so generously after all that Fisher had put him through."
"January 24, 1936",Fisher to Reisner once again looking for work.,"Fisher writes on stationery from the American School of Oriental Research Jerusalem, Palestine. He has just received word that their will be insufficient funds to keep him on at the school after the end of June. He is broke again and selling his books and furniture. “Please let me hear from you.” There is a note in red pencil that this letter was answered on January 27th, 1936."
1937,Fisher is “excavation architect” for a dig at Khirbet-et Tannur in Transjordon.,"Nelson Glueck, director of the American School of Oriental Research (ASOR) in Jerusalem, now known as the Albright Institute of Archaeological Research, conducted a dig at Khirbet-et Tannur for 7 weeks. The documentation from this dig is in the ASOR Nelson Glueck Archive at the Semitic Museum. It might be worth speaking to the author of the article, Judith McKenzie from Oxford University, about the archive and if it contains any personal information about Fisher."
"July 20, 1941",Clarence Fisher died.,This is the correct death date (-Joel Hoff).
