Date,Event,Description
"December 13, 1917",Fisher to Reisner claiming that Reisner still misunderstands. He planned to reorganize his staff anyway and does not acknowledge that there was any agreement. Quotes supporting statements from Gordon. Planning a legal accusation against Mahmud.,"Fisher writes from Dendereh and sends this letter by messenger to reach Reisner at Keneh on his way to Luxor. The messenger is Hamid Selah, a man dismissed by Reisner, which he think may possibly be intended as an insult by Fisher. Reisner says this in his long statement to Gordon sent January 9th, 1918.
 Fisher claims that he entered in to no agreement and “That this expedition never has demanded nor does it intend to demand that you employ or dismiss any man…”
 He also says that Mahmud and the guards stole things from the camp at Denderah.
 Wants his books back."
"December 26, 1917",Reisner to Gordon asking for his arbitration in the dispute with Fisher.,"Reisner writes from Kareima, Sudan. These pages seem to be a rough draft and may be somewhat different than the final letter. He is planning to copy all of his of correspondence with explanations and, though it will take time, he hopes that Gordon will suspend judgment until he can prepare this statement."
"January 2, 1918",Reisner writes to a Mr. Haines (from the Ministry?) asking him to read an enclosed letter in defense of Mahmud el-Mayyit who has been questioned by an Inspector at the Pyramids.,"Reisner writes from Kareima, Sudan. This note starts with, “Following my telegram of this date…”
 Apparently Fisher has followed thorough and brought charges against Mahmud. Reisner apologizes for troubling Haines with what should be a private matter.
 There is a piece of the rough draft of the enclosed letter on the back of this one that talks about Fisher’s vindictiveness and the fact that Fisher waited until Reisner had left Egypt to a place “where there is only one mail a week” to bring charges. “He clearly did not desire that my evidence should be considered…”
 The enclosed letter makes the above point more diplomatically.
 Reisner details what he knows of the complaints Fisher has against Mahmud and why they are unjustifiable. He makes Fisher sound petty. “The whole affair considered on the facts is a petty one with which I would be ashamed to trouble the department if the inspector had not taken it up.”"
"January 9, 1918",Reisner mails his statement with an explanatory letter to Dr. Gordon at the U. of P. as promised and “I leave the matter to your judgment.”,"Reisner writes from Kareima, Sudan. Harvard Camp Nuri Pyramids.
 Reisner believes that Gordon has formed a derogatory opinion of him based on Fisher’s reports.
 Reisner mentions that he has not had a vacation since 1911 and works 7 days because he is always understaffed.
 It is clear from this letter that at one point, because of something that Fisher had said in his letter of May 14th, Reisner had believed that Fisher deliberately planned to discharge men that Reisner had recommended and to take on men that he had discharged, as a deliberate insult. He explains why he doesn’t believe this anymore.
 Reisner partially blames himself for not handling this better.
 Reisner suspects that Fisher’s charges of theft to Mahmud, well after the fact of his dismissal, may have been instigated by members of Mahmud’s enemies, the Faid family, especially Khalleel Ahmed who replaced Mahmud as reis and who may have been trying to secure his own position.
 Reisner has excerpted all of their relevant exchanges, written and verbal, in the accompanying document, of which there are two, (not carbon copies), in the MFA archive file. This 18 page document his a very detailed, sometimes hour by hour, description of what specifically happened during this dispute, as Reisner saw it. Includes the history of his relationships with Mahmud el-Mayyit and with Khalleel Ahmed.
 There is an interesting statement on page regarding white men and black men telling the truth.
 He also explains that he understands Fisher’s nervous temperament and difficulty in speaking so has always felt lenient towards him and was prepared to endure his insults.
 There is a quotation of the evidence of Berberi Mahmud, a witness in Fisher’s camp, that states Mahmud gave notice and quit because Fisher wasn’t happy with the way thins were going.
 Praises Fisher’s potential . “In ten years or less he should be the most important archaeologist in Egypt…”"
"February 28, 1918",Reisner writes to Fairbanks mentioning the time delay in getting mail and what to do if anything should happen to him because of he war.,Reisner writes from the Nuri Pyramids. He details his latest finds and discusses the faithful services of Said Ahmed Said.
"May 24, 1918",G.B. Gordon writes to Reisner that he has waited more than four months for the statement that Reisner has promised him and has not received it.,"Mentions that he has a copy of Fisher’s diary on file. He does his best to settle he matter without all the information. This letter was sent in triplicate, most likely because of the difficulty of getting mail through during the war."
"June 20, 1918",G.B. Gordon writes to Reisner his resolution of the conflict with Fisher.,"Reisner sent a copy of his January 9th letter on March 21st because his original was lost at sea. The March 21st letter was “soaked in the sea.” Gordon assumes the mail bag with this letter was rescued from a torpedoed ship. It was still legible. Reisner also sent the same letter under separate cover that arrived 10 days later without harm.
 Gordon finds that Mahmud was dismissed legitimately but that they hold him blameless for the conduct of Mahmud. He says it “might be difficult for any newcomer to organize a gang without running the risk of employing someone whom you had at some time dismissed.” He also states, “In demanding of you the dismissal of Reis Mahmud, Mr. Fisher was therefore clearly wrong.”
  “I can see nothing to stand in the way of friendly relations.”"
"June 24, 1918","Reisner writes to Fisher a very polite letter that has nothing to do with their conflict. There will be no more letters on the subject, at least in this file.","Reisner writes from Harvard Camp at the Pyramids. He says, “your note of June 22 has just arrived.”
 This letter starts a discussion of the possibility of Fisher recovering for Reisner some objects that had been stolen."
"June 27, 1918",Fisher to Reisner with details of the whereabouts of he stolen property.,Fisher writes from Mit-Rahineh. The missing statue and stele are in the hands of the dealer Tano. The information was supplied to Fisher by an Englishman on the condition that Tano not be prosecuted. They can be bought back for £120.
"June 29, 1918",Reisner writes to Fisher and asks him to buy back the pieces.,Reisner writes from Harvard camp. He thinks that if he handles the purchase it “might frighten the holders of the stele and cause delay.” He says the statue belongs to the Eckley Coxe expedition and the stele to the Department of Antiquities. It is not clear why Reisner feels responsible for the recovery and why he is paying for their return.
"June 29, 1918",Fisher to Reisner agreeing to try to secure the two pieces.,Fisher writes from Mit-Rahineh. He asks Reisner for a “rough description of your piece…”
"July 1, 1918",Reisner to Fisher with a description of the stele.,"Reisner writes from Harvard Camp, Pyramids. Suggests threatening Tano with prosecution in a subtle way if he “behaves badly.”"
"July 2, 1918",Fisher to Reisner with more details about how the missing objects were spotted.,"Fisher from Mit-Raheineh. Lansing spotted the little statue in Tano’s shop. Mr. Carter (I assume, Howard) two moths ago said he new exactly where it was and would get back to Fisher. Carter said Tano had it along with them stele and would not sell them except together. Carter was the one who did not want Tano prosecuted because he did a lot of business with him. Fisher plans to ask Carter to reconsider."
"July 4, 1918",Reisner to Fisher that it may be a bad idea to prosecute Tano and he explains why.,"Reisner fro Harvard Camp, Pyramids. “I am willing, if necessary, to go to the length of paying the £120 to a man who appears to have been an innocent purchaser (i.e., as far as any dealer is ever an innocent purchaser).”"
"July 4, 1918",Fisher to Reisner that Carter insists upon the original terms.,"Writing from Mit-Rahineh, Badrashein."
"July 25, 1918",Reisner to Fisher asking for progress in the buy back of the stolen antiquities.,Reisner writes from Harvard camp.
"July 25, 1918",Fisher to Reisner that he is having trouble getting the objects back because Tano is away and seems to be afraid of the whole thing.,Fisher writes from the dahabiyeh “Hapi.” Fisher wants to get the whole thing settled because “I hope to have some war work to do which will take me out of Egypt temporarily.”
"October 14, 1918",Fisher to Reisner expecting to have the matter of the stolen antiquities settled in a few days.,Fisher writes from Cairo. “At the end of this month I expect to go up to Jerusalem in connection with the new school building there and also to look over the archaeological field. …another university has requested me to organize an expedition for them.”
"October 14, 1918",Reisner to Fisher with instructions on where to send the stone and when he can pay Fisher.,"Reisner writes from Harvard Camp, Pyramids. He says he is short of money but expecting a new letter of credit this month."
"October 28, 1918",Fisher to Reisner that he is sending “the three stones belonging to you.”,Fisher writes from Cairo.
"October 30, 1918",Reisner sends £100 for the payment to Tano and says the stones arrived all right.,"Reisner writes from Harvard Camp, Pyramids. He says he hopes to have “a division with M. Lacau and to be in a position to deliver the rest of the material to your charge.”"
"November 4, 1918",Fisher writes to Reisner thanking him for the money.,"Fisher writes from Badrashein. He says, “We are now down at Memphis again and I may not go up to Jerusalem until the spring.”"
"November 16, 1918",Fisher to Reisner that Tano has sent a bill of £155 instead of the original £120 agreed upon..,Fisher writes from Badrashein.
"November 16, 1918",Fisher to Reisner explaining why Tano feels he is owed more money.,Fisher writes from Badrashein. The details of the money problem are explained but unclear.
"December 20, 1918",Reisner to Fisher sending £20 more because he remembers now that is what he agreed to pay. Discusses the problems with the division with M. Lacau.,"Reisner writes from Harvard Camp, Pyramids. Tano’s borrowing problems are his own and Reisner is not obligated to pay any more than the agreed upon price. “The price in any case is perfectly ridiculous.”
 Reisner has not been able to complete the agreement with M. Lacau “either for my own things or for yours.” Lacau plans to keep the offering bowl. The delay won’t matter because nothing can be shipped until next summer.
 “I am leaving next week for the Sudan and will return in April.”"
"December 22, 1918",Fisher to Reisner that he has no record of any agreement with the Service.,"Fisher writes from Badrashein. He writes about the records from his dig in Reisner’s concession and his interaction with the M. Lacau and Mr. Daressy on the subject of the division.
 “I may have to return to America myself as soon as shipping is available.” “I shall be at Mit-Rahaneh until the middle of February when I expect to go to Jerusalem for a meeting…”"
"February 26, 1919",Fisher to Reisner asking if he would like to join with the Metropolitan and the U of P expedition “in shipping off our antiquities.”,Fisher writes care of the American Red Cross Jerusalem. His trip to Palestine is successful and he plans to return to America and London for conferences.
"March 8, 1919",British Deportation of Egyptian Nationalists,“The British government deported Saad Zaghlul Pasha and other Egyptian nationalist leaders to Malta to prevent their participation in the Paris Peace Conference. The Nationalist (Wafd) Party grew tremendously during World War I in response to British policies such as forced labor conscription and materials requisitions. The Wafd demanded independence for Egypt from British rule but the British had a vested interest in the state. The deportation of these Wafd leaders resulted in a national insurrection which the British army had to suppress.”
1919,Egyptian Insurrection,See description of insurrection at this web site
"April 4, 1919",Fisher to Reisner that his museum wishes him to stay in Egypt until conditions are easier.,"Fisher writes from Cairo. He says he received Reisner’s letter of March 19th. He presumes that Reisner was not affected by the recent uprisings in Egypt. He understands that Reisner’s house at they pyramids was unmolested. His dig at Mit-Raineh was undisturbed thanks to guards and the instruction of the Imam of the Mosque to respect them and their property as they were guests of the village. He is not yet allowed to return to Memphis.
 Sanborn has been in Jerusalem since September and acting as the Executive Secretary of the American Red Cross.
 Fisher discussed “the new antiquity law” at his conferences and claims it is almost word for word what he had proposed."
"May 1, 1919",Fisher writes to Reisner wondering if he has returned to Cairo or if he is still in the Sudan. Offers to look out for Reisner expedition at the Pyramids if Reisner is still in the Sudan because if the uprising.,"Fisher writes from Alexandria to Reisner care of Congdon & Co., Cairo. He reports that everything at Reisner’s Harvard Camp is all right. Fisher returned to Cairo from Jerusalem on March 24th. He could not get back to Memphis and had to wait it out at Ramleh. Plans to return to America this year and mentions that Gordon is coming to Egypt in a week or two. Plans to ship antiquities are delayed.
 There is now regular steamboat service on the Nile as far as Luxor."
"June 28, 1919","Treaty of Versailles, chief among 5 peace treaties to end World War 1, was signed.","“…the U.S. Senate refused to ratify the treaty, and the United States merely declared the war with Germany at an end in 1921.”"
"July 3, 1919",Fisher to Reisner asking for the artistic services of Mr. Kemp.,"Fisher writes from Memphis. Evidently Mr. Sanborn has recently visited Reisner. Fisher wants Kemp to make scale watercolor drawings of the offering-room of the Sneferu-Hotep mastaba that Fisher dug up for the U. of P. with permission of Reisner. He had hoped to have Mr. Carter do it, but he was too busy."
"July 6, 1919",Reisner to Fisher saying Mr. Kemp can do it(tomb G 300 B) but not until late summer.,"Reisner writes from Harvard Camp, Pyramids. Kemp costs the expedition £24 pounds a month."
"July 9, 1919",Fisher to Reisner asking about settling up the division with Lacau before Lacau goes on a three-month vacation.,Fisher writes from Memphis. Badrashein. Dr. Gordon will arrive at the end of the month for a short time and then he and Fisher will go on a trip together not returning before October. Hopes to settle the shipping arrangements.
"July 10, 1919",Reisner to Fisher about the division with M. Lacau. He won’t budge from the temporary division and that the offering stone must be kept by the Cairo Museum.,"Reisner writes from Harvard Camp, Pyramids. Offers to finish the division with M. Lacau for him or of transferring authority to Fisher to do it."
"July 25, 1919",Reisner to Fisher that the division is done.,"Reisner writes from Harvard Camp, Pyramids."
"July 28, 1919",Fisher invites Reisner to lunch with Dr. Gordon,Fisher writes from the Grand Continental Hotel in Cairo. Introduces the bearer of the message as his new assistant Alexander. In a P.S. he mentions having run into Lacau “so he is still here.”
"July 28, 1919",Reisner to Fisher that he would be happy to see Dr. Gordon.,"Reisner writes from Harvard Camp, Pyramids. Interestingly, on the back of this positive note about seeing Dr. Gordon is a crossed out negative version in which he says he is too busy to go to lunch but he could do it tomorrow. He also complains about giving up the three hours for the trip. Politeness won out over convenience."
"September 14, 1919",Reisner writes to Gordon thanks for the invitation to visit in Cairo but because of the tram strike he won’t be able to come.,"Reisner writes from Harvard Camp, Pyramids. Reisner is busy on his Kerma publication. He says, “Mrs. Bates has undertaken to publish [it] for her husband.” He states that he has gotten the concession for the Meroe pyramids and that Dows Dunham has made up his mind to join the expedition permanently. “…he is the right sort.” Hopes Mr. Fisher is all right as Sanborn said he was ill with a sore throat. Kemp not done with the drawings."
"October 26, 1919",Fisher to Reisner sending approval of the suggested correspondence course in hieroglyphics Reisner would give to Sanborn.,"Not clear where Fisher is writing from. Mentions that he will be supervising the work in three different places. Hopes to get the help of grad students,"
"November 6, 1919",Fisher to Reisner about removing the antiquities from his 1915 dig.,Fisher writes from Badreshein.
"November 6, 1919","Reisner to Fisher asking him to proof his , Fisher’s chapters in the Samaria publication.","Reisner writes from Harvard Camp, Pyramids. He says the whole publication thing has been held up because of the war. Talks about Sanborn being “a good man” and his correspondence course."
"November 24, 1919",Reisner asks Fisher to send his own men to pick up the antiquities.,"Reisner writes from Harvard Camp, Pyramids. “I trust you are properly disgusted with the way our politicians are behaving over the Peace Treaty. A shameful business.”"
"Nov. 30, 1919",Breasted visits Fisher at his camp.,Description by Breasted of staying with Fisher and his work at Bedrashein.
"December 10, 1919",Fisher to Reisner asking for Reisner’s corpus of pottery shapes.,Fisher writes from Memphis. He mentions Professor Breasted having asked him “to give them my scheme for the corpus [of architectural material] and suggests that I take up the architectural portion and also the pottery.…”
"December 19, 1919",Telegram from Fisher to Reisner about packing Fisher’s antiquities.,From Badreshein. “Will arrange send Sanborn Monday Tuesday to supervise packing if satisfactory Fisher”
"December 24, 1919",Reisner to Fisher saying no to the sending of the pottery drawings and expressing concerns for Fisher’s health.,"Reisner writes from Harvard Camp, Pyramids. Reisner says he plans to be at the University during 1920-21 at least for the first half year. Mentions that Fisher did not want Sanborn to accept Reisner’s hospitality during his packing and that a fearful storm delayed his work."
"December 25, 1919",Fisher writes to Reisner that he plans to get home for a few months in the spring and that he has secured the site of Beisan.,From Memphis. He also plans to resume work at Nippur as soon as conditions permit.
"May 10, 1922","Fisher writes to Reisner asking for a copy of, or if not published yet, a set of proofs of his book on Samaria.","Fisher writes from “Excavations Camp Beisan” in Palestine.
 Note: Beisan later became know as Bethshean."
"May 18, 1922",Reisner writes to Fisher that he thinks the book will be out in the fall.,"Reisner writes from Harvard Camp, Pyramids. As soon as he has cleared away the work from Begarawiyah he will find a copy of the Samaria stuff and send it to Fisher. Mentions that he heard Fisher found a good man, an Australian."
"June 29, 1922",Fisher to Reisner that he his having difficulty keeping up with the drawings for the excavations at Beisan and asking Reisner to lend him Bedawi for the purpose.,Fisher writes from “Excavations Camp Beisan” in Palestine. Mentions Rowe is doing well on the Egyptian stele. It “is either of Seti or Rameses II and commemorates his victory over the tribes of the valley from Beisan to Megiddo.
"July 4, 1922",Reisner to Fisher that he cannot spare Bedawi.,"From Harvard Camp Pyramids. Reisner suggests, that to solve his problem, Fisher adopt the technique of the “Arabic Diary” wherein the head reis tells a scribe what to write about the days work at the end of everyday. He gives details about how this would work and suggest having Berberi or Labib try it."
"October 30, 1922",Fisher sends telegram to Reisner asking him to meet to discuss “new laws.”,The office of origin of the telegram is Bedreshein. “Am leaving for Luxor Tuesday night could you arrange lunch with me Tuesday Continental and discuss cooperation regarding new laws reply not necessary Fisher?
"November 24, 1922",Fisher to Reisner that he was sorry to have missed him at lunch.,Fisher writes from Luxor. He explains that Mr. Greenlees said that Reisner said that some co-operation to protest the new laws regarding the division of antiquities should be arranged and also that Reisner would like Fisher to arrange a reconciliation with Lythgoe. He mentions that Breasted will take Megiddo.
"November 27, 1922","Reisner to Fisher explaining that he had only wanted Fisher to approach Lythgoe about the new regulations., “not on my behalf personally.”","Harvard Camp, Pyramids. Reisner says that if Fisher intends to credit him with the translations of Fisher’s writings on the Giza Inscriptions then he must correct the proofs because he had only done a rough translation for Fisher and it contains many inaccuracies. He advises Fisher to let Rowe do the translations and get the credit.
 Mentions that he has a conversation with Mrs. Fisher and Fisher’s sister after a lecture at Philadelphia last winter."
"August 23, 1923",Fisher to Reisner asking if Dunham is leaving Reisner and would Dunham like to “take over the Egyptian end of our work.”,"Fisher headlines the letter from Cairo, but signs it with Badrashein. Mentions a needy Mrs. Janssen, obviously a mutual acquaintance, who was written about to him by a Mrs. Spofford of the American Colony in Jerusalem (see:vhttp://www.smithsonianmag.si.edu/smithsonian/issues97/mar97/colony.html)
 Fisher also mentions that he “will have his hands too full carrying on continuously three digs year after year without a rest between them.”"
"August 24, 1923",Reisner to Fisher that Dunham has plans and would probably not consider them this year.,"Writes from Harvard Camp, Pyramids. Mentions that Dunham has already turned down an offer from the E.E.F. and that he intends to maintain his connection with the Boston Museum.
 Reisner says that “Kerma is out but I have not yet received a copy. “The Mycerinus Temples” goes to Boston in a few days. I am sorry not to have had your chapter on “materials and Construction” to add to the mss.”"
1925,Fisher resigns from the University of Pennsylvania Expedition,
1925,Clarence Fisher was hired in 1925 by James Henry Breasted to be the first field director of the Megiddo Expedition.,See footnote 2.
1925,Fisher is working for the Oriental Institute at Megiddo.,"“In 1925, excavations at Megiddo were renewed by the Oriental Institute of the University of Chicago. This large-scale undertaking, directed successively by Clarence Fisher, P.L.O. Guy and Gordon Loud, continued until the outbreak of World War II in 1939.”
 Note: There is a picture next to this text on this site that looks similar to a Reisner expedition photo. It looks like Fisher sitting center."
"March 28, 1926","Fisher to Reisner. A letter of introduction for his nephew in which he mentions, “Perhaps you could let them also have a peep at the new tomb.”",Fisher writes from Megiddo. Plans to start work April 15th. “We have the most wonderful house and equipment and I wish you and the family could come up to see us.”
"November 14, 1928",Fisher to Reisner thanking him for his kind letter.,Fisher writes from Ramallah. Fisher gives details about what he has been working on. His post as Professor in Archaeology at the Jerusalem school will be eliminated when the school is absorbed by the Oriental Institute. He hopes to become involved with new expeditions. He may visit the Pyramids at Christmas time.
"April 12, 1929",Fisher to Reisner confidentially asking about getting work at Samaria or in Egypt.,Fisher writes from Ramallah.
"April 29, 1929",Reisner to Fisher about the Lake-Blake proposals and the plan to include Fisher as Crowfoot’s assistant. Reisner is very interested in having Fisher join him again in Egypt.,"Reisner writes from Harvard Camp, Pyramids. He expects to return to Boston for the first half year 1929-1930. “Lt. Comm. Wheeler is expecting to remain in Egypt this summer.”"
"June 10, 1929",Fisher to Reisner that he would “like to link up again with you.”,"Fisher writes from Ramallah. Could Reisner use him during the winter season? He has another job with a Dr. Grant for work at Ain Shems but is not sure about how long or about salary. Doesn’t want to work in Samaria if it is a wholly British expedition. “You may know my views on that point, and how I left Penn because I demanded a chance for our own American boys.”
 Fisher is angry with Dr. Badé because Fisher feels he taught hem everything and corrected his errors only to have Badé claim credit."
